,name,neighbourhood,latitude,longitude,room_type,price,minimum_nights,number_of_reviews,availability_365,room
0,HARBORSIDE-Walk to subway,East Boston,42.36413,-71.02991,Entire home/apt,125,32,21,17,0
1,** Private! Minutes to center!**,Roxbury,42.32844,-71.09581,Entire home/apt,99,3,110,75,0
2,Home Away from Home! Condo,Roxbury,42.32802,-71.09387,Entire home/apt,250,3,116,127,0
3,Curved Glass Studio/1bd facing Park,Beacon Hill,42.35867,-71.06307,Entire home/apt,80,91,25,244,0
4,Bright 1bed facing Golden Dome,Downtown,42.35906,-71.06271,Entire home/apt,95,91,32,314,0
5,"Back Bay Apt-blocks to subway, Newbury St, The Pru",Back Bay,42.35061,-71.08787,Entire home/apt,116,29,5,365,0
6,North End (Waterfront area)  CLOSE TO MGH & SUBWAY,North End,42.36377,-71.05206,Entire home/apt,106,33,2,365,0
7,Back Bay studio apartment,Back Bay,42.35164,-71.08752,Entire home/apt,75,91,0,0,0
8,Small Room in Cambridge Kendall MIT,Beacon Hill,42.35956,-71.0698,Private room,50,91,0,365,1
9,The Dorset Redline | 3BR 1BA | Short walk to Redline for Mass General and UMass!,Dorchester,42.32212,-71.06096,Entire home/apt,111,30,52,200,0
10,COPLEY SQ...19TH C.TWNHSE SUNNY RM,South End,42.34487,-71.07441,Private room,148,29,315,89,1
11,"Luxury suite, Moroccan furnishings",Charlestown,42.37754,-71.06642,Entire home/apt,226,2,98,1,0
12,Private room & bath - Jamaica Plain,Jamaica Plain,42.31347,-71.11082,Private room,100,14,85,183,1
13,Gorgeous Garden Studio Charlestown,Charlestown,42.37424,-71.06081,Entire home/apt,125,29,131,86,0
14,Private Room with shared bath/Victorian House/ B,Dorchester,42.29871,-71.05954,Private room,70,1,331,107,1
15,Room in geographical heart of Hub,Roxbury,42.32546,-71.08894,Private room,80,29,142,99,1
16,Corner 1 bed facing Golden Dome,Downtown,42.35689,-71.06206,Entire home/apt,85,91,47,273,0
17,Waterfall Room: Bunker Hill B&B,Charlestown,42.37865,-71.06373,Private room,140,2,57,360,1
18,Beautiful Victorian House,Dorchester,42.29871,-71.05954,Private room,400,1,282,107,1
19,2 bed Duplex ApT! Location!,Roxbury,42.32806,-71.09423,Entire home/apt,241,3,236,127,0
20,Beautiful room with private bath/#2,Dorchester,42.29871,-71.05954,Private room,55,1,93,357,1
21,Private Room & private bath in Townhouse /#1,Dorchester,42.29871,-71.05954,Private room,50,1,47,250,1
22,Great 2BR in Boston near everything w free parking,Charlestown,42.37739,-71.06199,Entire home/apt,169,91,108,0,0
23,Beautiful 1 bedroom apt cld sleep 4,Charlestown,42.37823,-71.06778,Private room,245,29,0,134,1
24,In-Law Suite w/Room to Spare :-),Dorchester,42.30953,-71.0706,Entire home/apt,59,7,75,258,0
25,"Great Boston neighborhood , Jamaica Plain",Jamaica Plain,42.31331,-71.12061,Private room,60,30,50,68,1
26,Serene Studio in a Perfect Location,Jamaica Plain,42.31533,-71.11025,Entire home/apt,138,3,420,146,0
27,Beautiful Victorian House/Room C,Dorchester,42.29871,-71.05954,Private room,70,3,204,199,1
28,Treetop Haven in the City,Jamaica Plain,42.31685,-71.10867,Entire home/apt,102,3,224,250,0
29,Private room off the Freedom Trail.,North End,42.36614,-71.05226,Private room,150,3,261,0,1
30,BOSTON LUXURY FOR LESS!! NEAR BCEC,South Boston,42.33255,-71.04125,Entire home/apt,264,2,376,232,0
31,Beautiful Two BR & Two Bathroom Townhouse,Dorchester,42.29871,-71.05954,Entire home/apt,149,1,114,250,0
32,Room in a Beautiful Victorian House/A,Dorchester,42.29871,-71.05954,Private room,45,10,26,362,1
33,Private Room in Spacious Apartment1,Dorchester,42.30066,-71.08207,Private room,68,91,24,363,1
34,"Sweet Little House in JP, Boston",Jamaica Plain,42.31658,-71.11012,Private room,71,3,336,237,1
35,"Private Floor, Private Bath, City Location",Jamaica Plain,42.31062,-71.1176,Private room,173,91,16,0,1
36,"Great location, sunny 1-bedroom!",Bay Village,42.34914,-71.06781,Entire home/apt,65,180,9,0,0
37,BACK BAY/COPLEY FIRST FLOOR ROOM,South End,42.34491,-71.07368,Private room,148,29,175,89,1
38,The Grand View Redline | 5BR 2BA | Victorian Home near Boston Medical and Mass General!,Dorchester,42.31368,-71.0612,Entire home/apt,179,30,67,99,0
39,The Penthouse w/Central AC | 2BR 1BA w/En-Suite HdTV's! | Short walk to the Redline for UMass and Mass General!,Dorchester,42.32212,-71.06096,Entire home/apt,101,30,57,305,0
40,The Sky View w/AC | 3BR 1BA w/En-Suite HdTV's | Short Walk to Redline for Mass General and Boston Medical!,Dorchester,42.31371,-71.06126,Entire home/apt,101,30,62,259,0
41,Oasis in Boston's Hippest Neighborhood,Jamaica Plain,42.3036,-71.10539,Private room,121,29,291,329,1
42,"2 Bedrms, 2 Priv Bath&Priv Entrance",Dorchester,42.28834,-71.05505,Private room,200,3,98,101,1
43,The Mayhew w/Central AC! | 2BR 1BA w/En-Suite HdTV's | Short walk to the Redline for UMass and Mass General!,Dorchester,42.32212,-71.06095,Entire home/apt,101,30,55,185,0
44,"Boston Beauty, Walk to C and B line",Brighton,42.34096,-71.14647,Entire home/apt,149,91,12,0,0
45,"The Alameda 2 w/AC | 2BR 1BA w/En-Suite HdTV's | Short walk to train, shops and near Faulkner!",West Roxbury,42.29192,-71.15407,Entire home/apt,113,30,39,162,0
46,Houseboat in Boston Harbor,Charlestown,42.37579,-71.04981,Entire home/apt,200,2,53,350,0
47,Getaway in Historic Charlestown,Charlestown,42.37828,-71.06411,Entire home/apt,175,91,168,365,0
48,1 Bed in Charming Southie Townhouse near BCEC,South Boston,42.33451,-71.04983,Private room,190,1,7,173,1
49,Boston / Charlestown Apartment,Charlestown,42.37926,-71.06364,Entire home/apt,200,2,374,103,0
50,Unique Find: At Home in the City!,Jamaica Plain,42.30702,-71.11283,Entire home/apt,571,29,70,339,0
51,AVAILABLE NOW: Private room & shared bath,Roslindale,42.29239,-71.13193,Private room,25,91,5,261,1
52,"Private room, 7 min to subway, verdant & peaceful",Jamaica Plain,42.30733,-71.11129,Private room,70,2,214,32,1
53,6 miles away from downtown Boston!,Roslindale,42.28573,-71.12334,Private room,55,91,142,365,1
54,"Little Italy, Historic, Freedom Trail, TD Garden",North End,42.3657,-71.05618,Entire home/apt,117,1,551,160,0
55,*Cool Space* BOSTONS BEST!!* Minutes to Center*,Roxbury,42.32795,-71.09412,Entire home/apt,209,3,59,122,0
56,"Little Italy, Historic, Freedom Trail, TD Garden",North End,42.36695,-71.05601,Entire home/apt,106,1,647,159,0
57,"Modern Loft, 1700 SqFt. Location!",Downtown,42.3558,-71.06104,Entire home/apt,230,6,78,0,0
58,Private Room in Spacious Apartment3,Dorchester,42.29962,-71.08212,Private room,67,91,7,358,1
59,Private Room in Spacious Apartment2,Dorchester,42.29961,-71.07781,Private room,70,91,26,363,1
60,"Roof deck-city views. Walk everywhere! 2BR, 2 bath",South End,42.3451,-71.0715,Entire home/apt,595,3,12,41,0
61,GORGEOUS WATER FRT NORTH END STUDIO,North End,42.3665,-71.05296,Entire home/apt,95,2,487,71,0
62,Private room in house,Roslindale,42.29017,-71.13169,Private room,90,15,62,334,1
63,"Little Italy Historic, Freedom Trail, TD Garden",North End,42.36541,-71.05404,Entire home/apt,166,1,635,162,0
64,Perfect Central Location Sleeps 1-4,Downtown,42.35888,-71.06032,Entire home/apt,257,91,60,365,0
65,"The Dalton Apartment at The Upton, South End",South End,42.34308,-71.07316,Entire home/apt,214,1,62,103,0
66,HANCOCK TOWER/COPLEY ROOM,South End,42.34575,-71.07285,Private room,136,29,257,89,1
67,"Easy access to Airport, Downtown, Seaport. Fenway",East Boston,42.38497,-71.01827,Entire home/apt,174,2,87,364,0
68,Spacious 1 bdrm in Beacon Hill,Downtown,42.36194,-71.06256,Entire home/apt,160,91,8,0,0
69,Cozy JP Studio-Great Location!,Jamaica Plain,42.31653,-71.11049,Entire home/apt,94,2,327,0,0
70,"Studio Apt. for Rent in South End,",South End,42.34022,-71.075,Entire home/apt,176,91,0,0,0
71,Duplex Penthouse in Longwood Area,Mission Hill,42.33287,-71.10191,Entire home/apt,110,91,32,153,0
72,4 bedroom Victorian Condo unit,Jamaica Plain,42.32031,-71.1129,Entire home/apt,448,2,82,285,0
73,Victorian charm in the city,Dorchester,42.30347,-71.06409,Private room,38,91,194,365,1
74,Long-term Rental: Single Room/Sh Bath/No Cooking,Roslindale,42.2941,-71.13141,Private room,26,91,8,231,1
75,Beacon Hill 1-Bed,Beacon Hill,42.35977,-71.06774,Entire home/apt,207,91,65,0,0
76,"The Washington Apartment at The Upton, South End",South End,42.34294,-71.07304,Entire home/apt,170,1,65,95,0
77,Historic Beacon Hill,Beacon Hill,42.35714,-71.06968,Entire home/apt,425,91,23,359,0
78,Barney's Master Bedroom T Downtown,Dorchester,42.30907,-71.04674,Private room,41,1,580,0,1
79,"Authentic Boston, cozy room",Roxbury,42.32546,-71.08894,Private room,65,28,41,37,1
80,"Real Boston, off the beaten track",Roxbury,42.32546,-71.08894,Private room,67,29,39,126,1
81,Big Boston room,Roxbury,42.32546,-71.08894,Private room,75,29,20,138,1
82,Historic brick Victorian row house,South End,42.34164,-71.07964,Private room,350,2,27,71,1
83,Bright Sunlit bedroom near Spaulding/Downtown,Charlestown,42.38017,-71.06236,Private room,45,29,109,146,1
84,Inviting Queen Anne Victorian,Dorchester,42.30835,-71.04654,Private room,80,29,311,365,1
85,Room with Sleeper Sofa Bed,Dorchester,42.30818,-71.04784,Private room,60,29,45,365,1
86,Beautiful Studio 15 min to Downtown,Charlestown,42.38324,-71.07852,Entire home/apt,109,2,42,5,0
87,Charming Historic Home in Charlestown,Charlestown,42.37243,-71.06349,Entire home/apt,350,3,29,150,0
88,Large 1 Bed Apt w/ Full Kitchen & Bath + Parking!,Brighton,42.34873,-71.15693,Entire home/apt,113,1,162,155,0
89,2 bed/2 bath in the heart of Boston,Fenway,42.34175,-71.08359,Entire home/apt,415,91,43,365,0
90,4-story Central Luxury (message for short stays),Bay Village,42.34988,-71.06918,Entire home/apt,209,29,141,87,0
91,"Fort Hill Top - 2Bk Private room,  brick townhouse",Roxbury,42.3256,-71.09413,Private room,49,30,23,55,1
92,Large Private Bedroom & Bathroom by the Seaport,South Boston,42.33835,-71.0472,Private room,100,1,307,111,1
93,Room in Rozzie-Twin Bed-Full Bath,Roslindale,42.28132,-71.13377,Private room,58,29,37,0,1
94,"Sunny, welcoming 2 - bedroom condo in Boston",Brighton,42.35103,-71.17252,Entire home/apt,100,3,47,157,0
95,Charming 2 level Apartment,Roxbury,42.32382,-71.09641,Entire home/apt,120,30,233,352,0
96,Urban oasis trendy JP 'hood - suite,Jamaica Plain,42.31293,-71.11527,Entire home/apt,155,2,231,284,0
97,Quiet Sunlit Attic Studio,Roslindale,42.28639,-71.13199,Entire home/apt,79,30,7,339,0
98,Charming sunlit house in Boston,Roslindale,42.28447,-71.13301,Entire home/apt,180,29,44,229,0
99,king sized bed/ Private room in a spacious condo,Dorchester,42.29009,-71.05762,Private room,45,1,137,256,1
100,Room for 2 in Rozzie - Full Bath,Roslindale,42.28127,-71.13304,Private room,69,29,40,212,1
101,3Bed/2.5Bath Luxury Triplex South End's Union Park,South End,42.34279,-71.0711,Entire home/apt,890,29,44,231,0
102,Back Bay Elegance in Brighton,Brighton,42.3569,-71.1624,Private room,99,29,303,184,1
103,"RIVERVIEWS-Walk Everywhere! Central, Safe LOCATION",Fenway,42.34981,-71.09476,Entire home/apt,265,91,2,273,0
104,Queen Size Four Poster Bed,Dorchester,42.30837,-71.0461,Private room,100,29,211,365,1
105,Private Apartment- Minutes from T!,Jamaica Plain,42.29867,-71.1131,Entire home/apt,148,1,584,282,0
106,Beautiful Penthouse in Beacon Hill,Beacon Hill,42.35985,-71.0717,Entire home/apt,239,91,1,0,0
107,"Beautiful 3 bd- 1.5 bath with parking, in Boston.",Jamaica Plain,42.3079,-71.12378,Entire home/apt,1299,91,105,0,0
108,"Sea view,balcony,15min by metro to center,safe st",Dorchester,42.31465,-71.0624,Private room,95,2,150,356,1
109,One Private Bedroom in J.P.,Jamaica Plain,42.30593,-71.10733,Private room,120,91,38,365,1
110,1 bedroom and private bathroom,Brighton,42.34245,-71.15758,Private room,67,3,236,64,1
111,Spacious Updated 2 Bed Boston Condo w/ Deck,South Boston,42.3358,-71.04948,Entire home/apt,650,1,8,87,0
112,Spacious Updated Boston Room/Condo,South Boston,42.33375,-71.04767,Private room,220,29,85,353,1
113,Back Bay Studio,Back Bay,42.3504,-71.08891,Entire home/apt,70,91,34,0,0
114,"Studio, w kitchenette, in owner's Beacon Hill home",Beacon Hill,42.35771,-71.06978,Entire home/apt,165,29,111,91,0
115,Modern 2Bd1BA in Downtown Boston,Downtown,42.3559,-71.05998,Entire home/apt,300,91,7,0,0
116,Historic Boston North End Condo,North End,42.36446,-71.05429,Entire home/apt,195,91,169,339,0
117,"The Clare Suite at The Upton, South End",South End,42.34303,-71.07305,Entire home/apt,210,3,44,11,0
118,furnished 1 bed apartment copley #5,South End,42.34125,-71.07604,Entire home/apt,175,33,73,315,0
119,Modern South End Pied a Terre | 1BR 1BA,South End,42.33662,-71.0753,Entire home/apt,200,28,88,215,0
120,Light-filled Private Suite on Beautiful Street,Jamaica Plain,42.31146,-71.11947,Entire home/apt,144,2,148,158,0
121,* Brownstone Classic South End,South End,42.34568,-71.07169,Entire home/apt,119,29,408,0,0
122,1 BR Condo in a PRIME location with FULL amenities,South End,42.34506,-71.06159,Entire home/apt,139,91,0,207,0
123,Sunny Beacon Hill summer rental,Downtown,42.35702,-71.06168,Entire home/apt,100,91,36,214,0
124,Beacon Hill apartment - 1 bedroom + office,Beacon Hill,42.3596,-71.06555,Entire home/apt,65,91,0,0,0
125,"The Tremont Apartment at The Upton, South End",South End,42.34309,-71.07316,Entire home/apt,189,2,39,13,0
126,Charming comfort 1 BR / Studio,Brighton,42.34272,-71.15672,Entire home/apt,52,91,16,231,0
127,Cozy room in a charming villa.,Roslindale,42.27909,-71.13597,Private room,40,28,41,138,1
128,"Beautiful Boston North End spacious Light 2Bd, 1BA-2D",North End,42.36597,-71.05271,Entire home/apt,119,31,145,250,0
129,"Modern loft, walk to subway",Allston,42.35429,-71.13251,Private room,85,91,12,0,1
130,Charlesview Suites Back Bay,Back Bay,42.34492,-71.08482,Entire home/apt,280,29,78,365,0
131,Lofty Modern 2BD Apt 800 sq ft,Bay Village,42.34868,-71.07043,Entire home/apt,200,29,26,0,0
132,South End Chic,South End,42.34278,-71.07005,Entire home/apt,160,91,5,0,0
133,Perfect Location to Explore Boston,Beacon Hill,42.35902,-71.06296,Entire home/apt,150,365,100,107,0
134,"""Tranquility"" on ""Top of the Hill""",Roslindale,42.28278,-71.13878,Private room,85,91,75,365,1
135,SECOND FLOOR PARLOR ROOM,South End,42.34514,-71.07302,Private room,140,29,177,89,1
136,Beautiful 3 bedroom 2 bath apt in Charlestown,Charlestown,42.38148,-71.06967,Private room,595,5,0,365,1
137,BEAUTIFUL SINGLE FAMILY VICTORIAN in Hyde Park!,Hyde Park,42.26043,-71.11766,Entire home/apt,249,2,100,7,0
138,Luxury Sunny Hill Garden Townhouse Suite 1,Roxbury,42.31018,-71.08543,Entire home/apt,450,31,14,364,0
139,Garden Oasis #1,Jamaica Plain,42.31893,-71.11701,Private room,95,91,27,0,1
140,1bd APT 20min from Downtown Boston,Hyde Park,42.23533,-71.13256,Entire home/apt,89,91,33,243,0
141,Very Short Walk to the Red Line!,Dorchester,42.28814,-71.06889,Private room,45,30,7,364,1
142,1bd Boston apt - Convenient & quiet,Roslindale,42.28657,-71.13236,Entire home/apt,149,6,119,21,0
143,"Garden Suite near subway, beach",Dorchester,42.31281,-71.06098,Entire home/apt,123,2,209,289,0
144,Back Bay Quiet Renovated Studio Apt,Back Bay,42.35311,-71.08213,Entire home/apt,119,29,252,163,0
145,Quiet Southie 2bd Near the Beach and Broadway,South Boston,42.33306,-71.03291,Entire home/apt,107,29,23,353,0
146,Treetop Paradise by Jamaica Pond,Jamaica Plain,42.31632,-71.11417,Entire home/apt,139,91,15,365,0
147,Brownstone Bedroom Park & Garden Views by LMA & T,Roxbury,42.32811,-71.09157,Private room,75,2,255,87,1
148,"Eagle Sea view,15min metro ride to center,safe st!",Dorchester,42.31311,-71.06232,Private room,70,2,105,354,1
149,Gorgeous Condo w Huge Patio Back Bay Boston Common,Downtown,42.35065,-71.0666,Entire home/apt,350,91,0,0,0
150,New Stylish Modern Studio,Roxbury,42.31907,-71.09252,Entire home/apt,80,20,122,53,0
151,"Sunlit w/ huge kitchen, parking & easy to downtown",Brighton,42.35564,-71.15746,Entire home/apt,205,4,49,0,0
152,4th of July Dream Spot!,Back Bay,42.351,-71.08899,Entire home/apt,248,91,27,0,0
153,Luxury Beacon Hill Apartment 1-BR,Beacon Hill,42.35884,-71.06332,Entire home/apt,288,91,252,257,0
154,"Beautiful, Quiet, and Safe!",West Roxbury,42.29742,-71.157,Entire home/apt,119,91,4,0,0
155,The Roseclair w/Central AC! | 3BR 1BA w/En-Suite HdTV's | 2nd Floor near UMass Boston Redline T station!,Dorchester,42.32213,-71.06094,Entire home/apt,119,30,31,291,0
156,Beacon Hill!! Feet Fom State House,Downtown,42.35844,-71.06153,Entire home/apt,100,91,0,0,0
157,The Artist room in beautiful villa.,Roslindale,42.28037,-71.13669,Private room,50,28,32,232,1
158,"Modern, Spacious 1BR for 4 - Easy Marathon Access!",Roxbury,42.32843,-71.09369,Entire home/apt,167,91,254,358,0
159,Immaculate space with off street parking!,Dorchester,42.28512,-71.07672,Shared room,110,91,5,364,2
160,Parking Close 2 Downtown Renovated,Roxbury,42.31676,-71.08,Private room,38,150,6,365,1
161,2 bedroom condo in Downtown Boston,North End,42.3636,-71.05367,Entire home/apt,225,31,50,113,0
162,Small Rm +walk-in closet Easy to Longwood/Downtown,Roxbury,42.31676,-71.08,Private room,33,150,0,365,1
163,Grand Colonial in Historic Boston.,Charlestown,42.37358,-71.06309,Entire home/apt,160,32,277,244,0
164,2 Bedroom Modern City Condo,South Boston,42.33526,-71.05216,Entire home/apt,414,3,8,43,0
165,Beacon Hill Fabulous One Bedroom Apartment,Beacon Hill,42.35792,-71.06432,Entire home/apt,125,29,242,113,0
166,The Hedges: Sunny urban garden home with breakfast,Jamaica Plain,42.31016,-71.10582,Private room,94,29,128,30,1
167,Minutes to Boston-Near Beach 69-1,East Boston,42.38679,-71.00271,Private room,42,91,91,90,1
168,"Sensational South End- 2BR, no stairs, Location!",South End,42.33765,-71.07434,Entire home/apt,150,29,346,50,0
169,Sunlit room with private bath,Jamaica Plain,42.31826,-71.09956,Private room,90,29,181,90,1
170,"""Room with a View""  from ""Top of the Hill""",Roslindale,42.28289,-71.14078,Private room,85,91,26,364,1
171,"North End, 1 Bed Apt w/ office, Boston",North End,42.36722,-71.05266,Entire home/apt,229,14,59,0,0
172,Sanitized Modern 3BD private home-near BCEC,South Boston,42.3357,-71.05395,Entire home/apt,240,1,678,258,0
173,Sunny Private Studio Aptmt,Jamaica Plain,42.30385,-71.1151,Entire home/apt,125,29,256,235,0
174,Back Bay Charmer,Back Bay,42.35491,-71.07463,Entire home/apt,225,91,15,0,0
175,Luxury Studio Apt in North End,North End,42.36684,-71.0529,Entire home/apt,119,29,27,60,0
176,Quiet Artist's Retreat,Jamaica Plain,42.31246,-71.10793,Private room,98,29,40,272,1
177,Two Bedroom Apartment in Kenmore Sq,Fenway,42.34853,-71.09256,Entire home/apt,250,91,0,0,0
178,Brownstone Master Bath Suite Park Views by LMA & T,Roxbury,42.32971,-71.0931,Private room,82,2,337,8,1
179,Studio apart Tremont St South End #2,South End,42.34128,-71.07607,Entire home/apt,85,33,70,292,0
180,Great location!,Brighton,42.33678,-71.15237,Entire home/apt,90,91,4,0,0
181,Master Suite@ Logan Airport,East Boston,42.38903,-71.00251,Private room,100,91,1,363,1
182,Room Logan Airport + 1/2 bathroom,East Boston,42.38829,-71.00437,Private room,80,100,5,365,1
183,Cozy Jamaica Plain Pad,Jamaica Plain,42.31128,-71.10981,Private room,150,91,0,0,1
184,large & grand 2 bedroom South End by Copley Sq #3,South End,42.34128,-71.07607,Entire home/apt,120,33,141,275,0
185,newly furn one bedroom by Copley #6,South End,42.34128,-71.07607,Entire home/apt,110,31,81,336,0
186,"Grt Location, Big 3 Bed,Nr all Colleges, Hospitals",Brighton,42.35309,-71.14822,Entire home/apt,600,45,9,272,0
187,Brownstone Bedroom Treetop Skyline View by LMA & T,Roxbury,42.32942,-71.09149,Private room,75,2,240,76,1
188,Queen room in a charming villa,Roslindale,42.28026,-71.13584,Private room,50,28,36,225,1
189,Comfy Beacon Hill Studio Great for Work Travel; #13,Beacon Hill,42.36017,-71.06346,Entire home/apt,120,1,119,244,0
190,South End Studio Perfect for Work Travel #36,South End,42.34441,-71.07633,Entire home/apt,84,1,84,352,0
191,"Stylish Downtown Studio in the SouthEnd, #8",South End,42.34447,-71.07644,Entire home/apt,140,1,131,344,0
192,"Stylish Studio in Back Bay, on Newbury St; #1",Back Bay,42.34982,-71.08264,Entire home/apt,140,1,141,346,0
193,Charming & Historic 2 bed/2 bath w/ private patio,Charlestown,42.37866,-71.06452,Entire home/apt,363,4,55,145,0
194,5 bedrooms 3 baths monthly Rental now,Allston,42.35984,-71.12873,Entire home/apt,450,31,33,357,0
195,Brownstone Loft Bedroom Rooftop Views by LMA & T,Roxbury,42.32965,-71.0932,Private room,69,2,290,25,1
196,Historic Beauty! Minutes to Center!,Roxbury,42.32397,-71.09085,Entire home/apt,184,3,88,143,0
197,The Copley Suite - Radiant & Airy in the South End,South End,42.34301,-71.07304,Entire home/apt,125,120,20,0,0
198,Brownstone Cozy Private Studio by the T & LMA,Roxbury,42.32967,-71.09328,Entire home/apt,96,2,523,74,0
199,Chic furnished 2 bds- best Boston location N. End Boston,North End,42.36424,-71.05259,Entire home/apt,133,31,157,336,0
200,Unique Fenway/Back Bay/Copley 1 Bed,Fenway,42.345,-71.09514,Entire home/apt,148,3,174,148,0
201,Amazing price and location w/ parking  N End (m1s),North End,42.36329,-71.05233,Entire home/apt,153,2,150,347,0
202,Lovely private 4 bedroom apt,Jamaica Plain,42.3043,-71.11465,Entire home/apt,211,2,232,1,0
203,Parking EZ 2 Downtown/Longwood Larg,Roxbury,42.31676,-71.08,Private room,36,150,7,364,1
204,Parking Renovated Close to Downtown,Roxbury,42.31676,-71.08,Private room,36,150,1,365,1
205,2 Bd/Bth Apt in Prime Location Gorgeous Water View,West End,42.36452,-71.06928,Entire home/apt,250,90,18,290,0
206,Boston RooftopTerrace/ 2 Bed / By Logan airport,East Boston,42.378693,-71.035088,Entire home/apt,234,1,234,333,0
207,South End Studio Perfect for Work Travel #46,South End,42.34441,-71.07633,Entire home/apt,99,1,118,364,0
208,Parking Easy to downtown/Longwood,Roxbury,42.31676,-71.08,Private room,35,150,4,365,1
209,GreenT&bus stops in front of door,Mission Hill,42.33245,-71.10642,Private room,100,91,0,0,1
210,Charming studio,Brighton,42.34341,-71.15451,Entire home/apt,49,91,14,241,0
211,Beacon Hill Duplex  2 bedrooms Queen beds sleeps 4,Beacon Hill,42.35998,-71.06488,Entire home/apt,305,29,69,305,0
212,Historic House modernized,Brighton,42.34765,-71.15509,Entire home/apt,350,3,132,259,0
213,Charming Victorian Furnished Home,Hyde Park,42.2563,-71.12762,Entire home/apt,145,91,105,220,0
214,Cozy Attic Bedroom in Allston,Allston,42.35914,-71.13348,Private room,41,91,3,0,1
215,Cosy Celtic Retreat,Brighton,42.35111,-71.16529,Private room,65,91,25,364,1
216,One Sweet Place,Mattapan,42.27667,-71.08169,Private room,27,29,20,236,1
217,Romantic Beacon Hill Studio,Beacon Hill,42.35815,-71.07102,Entire home/apt,110,91,5,0,0
218,Ensuite Private Room in Boston,South Boston,42.33717,-71.05,Private room,103,2,241,227,1
219,"ALLSTON LOADED STUDIO: Steps to BU, BC & hospitals",Allston,42.34838,-71.13163,Entire home/apt,79,240,340,163,0
220,Modern Beacon Hill 2 Bedroom,West End,42.36122,-71.06629,Entire home/apt,158,2,110,13,0
221,Sunny Duplex Condo + Private Parking,South Boston,42.33257,-71.02959,Entire home/apt,325,3,148,328,0
222,Beautiful & Spacious 4 BDR / 3 BA w/ FREE Parking,Allston,42.35779,-71.13347,Entire home/apt,486,4,226,326,0
223,3rd floor room in Victorian House,Dorchester,42.31124,-71.06551,Private room,45,2,34,351,1
224,Quiet room - Great location!,Jamaica Plain,42.31327,-71.10811,Private room,60,30,25,288,1
225,Beacon Hill Brownstone,Beacon Hill,42.35921,-71.06759,Entire home/apt,147,91,24,0,0
226,Stunning SouthEnd/BackBay Penthouse,Roxbury,42.34041,-71.08384,Entire home/apt,464,29,100,299,0
227,2 Bdrm Apt w/ tower in JP Victorian,Jamaica Plain,42.30542,-71.10409,Entire home/apt,166,2,272,248,0
228,Newly-Renovated Condo,Mission Hill,42.32713,-71.10663,Private room,75,1000,0,0,1
229,Family friendly Boston home,Roxbury,42.32338,-71.09334,Entire home/apt,400,29,9,319,0
230,"Renovated, Quiet, Free Parking",Roxbury,42.31681,-71.08001,Private room,42,150,6,365,1
231,**Studio by Airport and T Station**,East Boston,42.38704,-71.00581,Entire home/apt,68,60,85,90,0
232,Cool room with private bathroom.,Roslindale,42.27863,-71.13637,Private room,50,28,0,230,1
233,Beautiful 3 bedroom Dorchester MA,Dorchester,42.31163,-71.06351,Entire home/apt,104,29,261,250,0
234,Quiet  Beauty in Boston,Roslindale,42.28629,-71.13839,Entire home/apt,155,14,26,363,0
235,City living near the beach!,East Boston,42.38455,-71.00217,Entire home/apt,195,91,27,0,0
236,Parking Renovated Close to Downtown,Roxbury,42.31676,-71.08,Private room,36,150,2,365,1
237,*Penthouse Duplex* Close to Center,Mission Hill,42.33211,-71.09842,Entire home/apt,191,3,116,153,0
238,"Fresh! City Loft Apartment,  Minutes to Center!",Roxbury,42.3285,-71.09608,Entire home/apt,179,3,123,133,0
239,Private Entrance * King Beds! * Kid Friendly,Back Bay,42.34628,-71.08064,Entire home/apt,350,29,203,20,0
240,"Beacon Hill House, Huge Roof Deck & Encore Casino",Beacon Hill,42.35668,-71.07185,Entire home/apt,310,91,124,80,0
241,Central Boston Beacon Hill 2brm,Beacon Hill,42.35984,-71.06914,Entire home/apt,221,28,349,344,0
242,"Heart of South End, Convenient, Comfy Studio #42",South End,42.34441,-71.07633,Entire home/apt,106,1,138,310,0
243,"Charming South End Brownstone, 2bedroom with a patio",South End,42.34455,-71.07628,Entire home/apt,156,29,141,94,0
244,Sunny Two-Bedroom in Boston,Jamaica Plain,42.32448,-71.10664,Entire home/apt,95,91,0,0,0
245,"Stylish Downtown Studio in the SouthEnd, C.Ave# 4",South End,42.34447,-71.07644,Entire home/apt,140,1,124,356,0
246,"Stylish Downtown Studio in the SouthEnd, C.Ave# 3",South End,42.34447,-71.07644,Entire home/apt,109,1,225,260,0
247,Large room located in Allston,Allston,42.35211,-71.13178,Private room,70,91,0,0,1
248,City Sanctuary with ocean view and terrace garden,South Boston,42.33286,-71.04506,Entire home/apt,170,5,38,264,0
249,"""La Gemma"" - a gem in the North End",North End,42.36726,-71.05424,Entire home/apt,300,3,235,97,0
250,Close to Airport and Subway,East Boston,42.37939,-71.02961,Entire home/apt,125,91,31,90,0
251,Sunny 1BR for Summer,Fenway,42.34306,-71.0872,Entire home/apt,62,91,0,0,0
252,Walk To Beach or City 1 -Our #1 Requested Room,Dorchester,42.31776,-71.05795,Private room,50,29,225,338,1
